{
  "schema_version": 1,
  "id": "opus-mt-es-en",
  "model_revision": "c96e2c5399ebfae4fc43d9669556b9afa74bb69d",
  "artifact_revision": "eadfd7c658a9d8929ac3b8e996b68a68e2c7d480",
  "purpose": "translation",
  "authors": [
    "Helsinki-NLP",
    "Xenova"
  ],
  "license_id": "NOASSERTION",
  "usage_restrictions": [
    "base_model_helsinki_nlp_opus_mt_es_en_declares_apache_2_0",
    "redistributor_xenova_does_not_declare_an_explicit_license_tag",
    "commercial_review_pending"
  ],
  "languages": [
    "es",
    "en"
  ],
  "voices": [],
  "runtime_id": "onnxruntime-swift-package-manager",
  "runtime_version": "1.24.2",
  "distribution_status": "pending_review",
  "artifacts": [
    {
      "relative_path": "data/onnx/encoder_model_quantized.onnx",
      "role": "model_encoder_weights",
      "source_url": "https://huggingface.co/Xenova/opus-mt-es-en/resolve/eadfd7c658a9d8929ac3b8e996b68a68e2c7d480/onnx/encoder_model_quantized.onnx",
      "publisher": "Xenova",
      "format": "onnx",
      "quantization": "int8",
      "size_bytes": 52899742,
      "sha256_hex": "c01e70f8455efc350831aa2af7ed187b16829241f0018ba07d1ba643a391bc18"
    },
    {
      "relative_path": "data/onnx/decoder_model_merged_quantized.onnx",
      "role": "model_decoder_weights",
      "source_url": "https://huggingface.co/Xenova/opus-mt-es-en/resolve/eadfd7c658a9d8929ac3b8e996b68a68e2c7d480/onnx/decoder_model_merged_quantized.onnx",
      "publisher": "Xenova",
      "format": "onnx",
      "quantization": "int8",
      "size_bytes": 60212804,
      "sha256_hex": "4cd91ab30240d295ce907b5100826031838c672005e57e524d711122d75605fa"
    },
    {
      "relative_path": "data/source.spm",
      "role": "tokenizer_vocab_source",
      "source_url": "https://huggingface.co/Xenova/opus-mt-es-en/resolve/eadfd7c658a9d8929ac3b8e996b68a68e2c7d480/source.spm",
      "publisher": "Xenova",
      "format": "sentencepiece",
      "quantization": "not_applicable",
      "size_bytes": 825924,
      "sha256_hex": "e236ee6d866b635c0142114f8647f39831f9d92534aa2aad75c942f6a78ad0e3"
    },
    {
      "relative_path": "data/target.spm",
      "role": "tokenizer_vocab_target",
      "source_url": "https://huggingface.co/Xenova/opus-mt-es-en/resolve/eadfd7c658a9d8929ac3b8e996b68a68e2c7d480/target.spm",
      "publisher": "Xenova",
      "format": "sentencepiece",
      "quantization": "not_applicable",
      "size_bytes": 801636,
      "sha256_hex": "4dd547c24816a335e7b0b2e63376a8f1b3cbfc671eda5ab808dd44fdadaa8791"
    },
    {
      "relative_path": "data/tokenizer.json",
      "role": "tokenizer_config",
      "source_url": "https://huggingface.co/Xenova/opus-mt-es-en/resolve/eadfd7c658a9d8929ac3b8e996b68a68e2c7d480/tokenizer.json",
      "publisher": "Xenova",
      "format": "json",
      "quantization": "not_applicable",
      "size_bytes": 6262682,
      "sha256_hex": "285eb29e7155ee48851a77960797813f86a125f70d2c1a124f613f1fbd2b19c3"
    },
    {
      "relative_path": "data/config.json",
      "role": "model_config",
      "source_url": "https://huggingface.co/Xenova/opus-mt-es-en/resolve/eadfd7c658a9d8929ac3b8e996b68a68e2c7d480/config.json",
      "publisher": "Xenova",
      "format": "json",
      "quantization": "not_applicable",
      "size_bytes": 1433,
      "sha256_hex": "fab3a7f93185bc5aa7b419f6a1e6e74d98c8f2a506c94493d3019bf46da3478d"
    }
  ]
}
